<xs:schema xmlns:xs="http://www.w3.org/2001/XMLSchema">
<xs:complexType name="egyetem">
    <xs:sequence>
        <xs:element name="iranyitoszam" type="xs:string"/>
        <xs:element name="varos" type="xs:string"/>
        <xs:element name="utca" type="xs:string"/>
        <xs:element name="hazszam" type="xs:string"/>
        <xs:element name="telefonszam" type="xs:string"/>
        <xs:element name="weblap" type="xs:string"/>
    </xs:sequence>
</xs:complexType>
    <xs:element name="nevjegykartya">
        <xs:complexType>
            <xs:sequence>
                <xs:element name="nev" type="xs:string"/>
                <xs:element name="egyetem" type="egyetem"/>
                <xs:element name="beosztas" type="xs:string"/>
                <xs:element name="telefonszam" type="xs:string"/>
                <xs:element name="email" type="xs:string"/>
                <xs:element name="abstract" type="xs:string"/> 
            </xs:sequence>
        </xs:complexType>
    </xs:element>
</xs:schema>